{
  "id": "test",
  "name": "test",
  "description": "",
  "created": "2026-01-11T13:52:36.430948Z",
  "updated": "2026-01-11T16:18:10.122887Z",
  "protocol_files": [
    "protocol/field_protocol_bkm.pdf"
  ],
  "map_files": [
    "maps/sites.kml"
  ],
  "feature_types": [
    "Shola Patch (Classified)",
    "Transect",
    "Transect Start/Marker"
  ],
  "status": {
    "stage": "features",
    "features": "complete",
    "variables": "pending",
    "indicators": "pending",
    "mismatches": "pending",
    "html": "pending"
  },
  "status_history": [
    {
      "stage": "initialized",
      "status": "complete",
      "timestamp": "2026-01-11T13:52:36.430948Z"
    },
    {
      "stage": "features",
      "status": "in_progress",
      "timestamp": "2026-01-11T15:19:58.833057Z"
    },
    {
      "stage": "features",
      "status": "failed",
      "timestamp": "2026-01-11T15:23:05.325018Z",
      "error": "Gemini CLI failed: Cannot use both a positional prompt and the --prompt (-p) flag together\nUsage: gemini [options] [command]\n\nGemini CLI - Launch an interactive CLI, use -p/--prompt for non-interactive mode\n\nCommands:\n  gemini [query..]             Launch Gemini CLI  [default]\n  gemini mcp                   Manage MCP servers\n  gemini extensions <command>  Manage Gemini CLI extensions.  [aliases: extension]\n\nPositionals:\n  query  Positional prompt. Defaults to one-shot; use -i/--prompt-interactive for interactive.\n\nOptions:\n  -d, --debug                     Run in debug mode?  [boolean] [default: false]\n  -m, --model                     Model  [string]\n  -p, --prompt                    Prompt. Appended to input on stdin (if any).  [deprecated: Use the positional prompt instead. This flag will be removed in a future version.] [string]\n  -i, --prompt-interactive        Execute the provided prompt and continue in interactive mode  [string]\n  -s, --sandbox                   Run in sandbox?  [boolean]\n  -y, --yolo                      Automatically accept all actions (aka YOLO mode, see https://www.youtube.com/watch?v=xvFZjo5PgG0 for more details)?  [boolean] [default: false]\n      --approval-mode             Set the approval mode: default (prompt for approval), auto_edit (auto-approve edit tools), yolo (auto-approve all tools)  [string] [choices: \"default\", \"auto_edit\", \"yolo\"]\n      --experimental-acp          Starts the agent in ACP mode  [boolean]\n      --allowed-mcp-server-names  Allowed MCP server names  [array]\n      --allowed-tools             Tools that are allowed to run without confirmation  [array]\n  -e, --extensions                A list of extensions to use. If not provided, all extensions are used.  [array]\n  -l, --list-extensions           List all available extensions and exit.  [boolean]\n  -r, --resume                    Resume a previous session. Use \"latest\" for most recent or index number (e.g. --resume 5)  [string]\n      --list-sessions             List available sessions for the current project and exit.  [boolean]\n      --delete-session            Delete a session by index number (use --list-sessions to see available sessions).  [string]\n      --include-directories       Additional directories to include in the workspace (comma-separated or multiple --include-directories)  [array]\n      --screen-reader             Enable screen reader mode for accessibility.  [boolean]\n  -o, --output-format             The format of the CLI output.  [string] [choices: \"text\", \"json\", \"stream-json\"]\n  -v, --version                   Show version number  [boolean]\n  -h, --help                      Show help  [boolean]\n"
    },
    {
      "stage": "features",
      "status": "in_progress",
      "timestamp": "2026-01-11T15:25:27.407865Z"
    },
    {
      "stage": "features",
      "status": "failed",
      "timestamp": "2026-01-11T15:25:28.737296Z",
      "error": "Gemini CLI failed: Cannot use both a positional prompt and the --prompt (-p) flag together\nUsage: gemini [options] [command]\n\nGemini CLI - Launch an interactive CLI, use -p/--prompt for non-interactive mode\n\nCommands:\n  gemini [query..]             Launch Gemini CLI  [default]\n  gemini mcp                   Manage MCP servers\n  gemini extensions <command>  Manage Gemini CLI extensions.  [aliases: extension]\n\nPositionals:\n  query  Positional prompt. Defaults to one-shot; use -i/--prompt-interactive for interactive.\n\nOptions:\n  -d, --debug                     Run in debug mode?  [boolean] [default: false]\n  -m, --model                     Model  [string]\n  -p, --prompt                    Prompt. Appended to input on stdin (if any).  [deprecated: Use the positional prompt instead. This flag will be removed in a future version.] [string]\n  -i, --prompt-interactive        Execute the provided prompt and continue in interactive mode  [string]\n  -s, --sandbox                   Run in sandbox?  [boolean]\n  -y, --yolo                      Automatically accept all actions (aka YOLO mode, see https://www.youtube.com/watch?v=xvFZjo5PgG0 for more details)?  [boolean] [default: false]\n      --approval-mode             Set the approval mode: default (prompt for approval), auto_edit (auto-approve edit tools), yolo (auto-approve all tools)  [string] [choices: \"default\", \"auto_edit\", \"yolo\"]\n      --experimental-acp          Starts the agent in ACP mode  [boolean]\n      --allowed-mcp-server-names  Allowed MCP server names  [array]\n      --allowed-tools             Tools that are allowed to run without confirmation  [array]\n  -e, --extensions                A list of extensions to use. If not provided, all extensions are used.  [array]\n  -l, --list-extensions           List all available extensions and exit.  [boolean]\n  -r, --resume                    Resume a previous session. Use \"latest\" for most recent or index number (e.g. --resume 5)  [string]\n      --list-sessions             List available sessions for the current project and exit.  [boolean]\n      --delete-session            Delete a session by index number (use --list-sessions to see available sessions).  [string]\n      --include-directories       Additional directories to include in the workspace (comma-separated or multiple --include-directories)  [array]\n      --screen-reader             Enable screen reader mode for accessibility.  [boolean]\n  -o, --output-format             The format of the CLI output.  [string] [choices: \"text\", \"json\", \"stream-json\"]\n  -v, --version                   Show version number  [boolean]\n  -h, --help                      Show help  [boolean]\n"
    },
    {
      "stage": "features",
      "status": "complete",
      "timestamp": "2026-01-11T15:31:33.288874Z"
    },
    {
      "stage": "features",
      "status": "complete",
      "timestamp": "2026-01-11T15:57:32.389251Z"
    },
    {
      "stage": "features",
      "status": "in_progress",
      "timestamp": "2026-01-11T15:59:14.776964Z"
    },
    {
      "stage": "features",
      "status": "failed",
      "timestamp": "2026-01-11T16:00:16.863026Z",
      "error": "Could not extract valid JSON from output: {\n  \"$schema\": \"http://json-schema.org/draft-07/schema#\",\n  \"type\": \"object\",\n  \"properties\": {\n    \"feature_mappings\": {\n      \"type\": \"array\",\n      \"items\": {\n        \"type\": \"object\",\n        \"properties\": {\n          \"kml_feature_name\": {\n            \"type\": \"string\"\n          },\n          \"feature_type\": {\n            \"type\": \"string\"\n          },\n          \"protocol_reference\": {\n            \"type\": \"string\"\n          },\n          \"confidence\": {\n            \"type\": \"string\",\n            "
    },
    {
      "stage": "features",
      "status": "complete",
      "timestamp": "2026-01-11T16:04:53.748550Z"
    },
    {
      "stage": "features",
      "status": "complete",
      "timestamp": "2026-01-11T16:10:05.440580Z"
    },
    {
      "stage": "features",
      "status": "complete",
      "timestamp": "2026-01-11T16:18:10.122887Z"
    }
  ]
}